[
  {
    "id": "sign-a-document-signer",
    "title": "Sign a document: create it with one signer",
    "title_pt": "Assinar um documento: criá-lo com um signatário",
    "description": "Uploads a PDF, then creates a document whose flow has a single `Signer` action; Signer e-mails the participant an invitation to sign.",
    "product": "signer",
    "area": "documents",
    "language": "dotnet",
    "framework": "console",
    "path": "dotnet/console/Console/Scenarios/CreateDocumentWithOneSignerScenario.cs",
    "related_files": [
      "dotnet/console/Console/Program.cs",
      "dotnet/console/Console/Scenarios/Scenario.cs",
      "dotnet/console/Console/sample.pdf"
    ],
    "status": "current",
    "docs_url": "https://docs.lacunasoftware.com/en-us/articles/signer/get-started",
    "demo_url": "https://try.lacunasoftware.com/en/signer/sign-a-document",
    "run": {
      "cwd": "dotnet/console",
      "command": "Open Console.sln in Visual Studio and press F5",
      "url": null
    }
  },
  {
    "id": "sign-a-document-signer",
    "title": "Sign a document: create it with one signer",
    "title_pt": "Assinar um documento: criá-lo com um signatário",
    "description": "Uploads a PDF, then creates a document whose flow has a single `Signer` action; Signer e-mails the participant an invitation to sign.",
    "product": "signer",
    "area": "documents",
    "language": "java",
    "framework": "console",
    "path": "java/console/src/main/java/com/lacunasoftware/signer/sample/scenarios/CreateDocumentWithOneSignerScenario.java",
    "related_files": [
      "java/console/src/main/java/com/lacunasoftware/signer/sample/App.java",
      "java/console/src/main/java/com/lacunasoftware/signer/sample/scenarios/Scenario.java",
      "java/console/src/main/java/com/lacunasoftware/signer/sample/Util.java",
      "java/console/src/main/resources/static/sample.pdf"
    ],
    "status": "current",
    "docs_url": "https://docs.lacunasoftware.com/en-us/articles/signer/get-started",
    "demo_url": "https://try.lacunasoftware.com/en/signer/sign-a-document",
    "run": {
      "cwd": "java/console",
      "command": "./gradlew run",
      "url": null
    }
  },
  {
    "id": "sign-a-document-signer",
    "title": "Sign a document: create it with one signer",
    "title_pt": "Assinar um documento: criá-lo com um signatário",
    "description": "Uploads a PDF, then creates a document whose flow has a single `Signer` action; Signer e-mails the participant an invitation to sign.",
    "product": "signer",
    "area": "documents",
    "language": "nodejs",
    "framework": "console",
    "path": "nodejs/scenarios/createDocumentWithOneSignerScenario.ts",
    "related_files": [
      "nodejs/scenarios/scenario.ts",
      "nodejs/samples/sample.pdf"
    ],
    "status": "current",
    "docs_url": "https://docs.lacunasoftware.com/en-us/articles/signer/get-started",
    "demo_url": "https://try.lacunasoftware.com/en/signer/sign-a-document",
    "run": {
      "cwd": "nodejs",
      "command": "npm install && npx ts-node scenarios/createDocumentWithOneSignerScenario.ts",
      "url": null
    }
  },
  {
    "id": "sign-a-document-signer",
    "title": "Sign a document: create it with one signer",
    "title_pt": "Assinar um documento: criá-lo com um signatário",
    "description": "Uploads a PDF, then creates a document whose flow has a single `Signer` action; Signer e-mails the participant an invitation to sign.",
    "product": "signer",
    "area": "documents",
    "language": "php",
    "framework": "console",
    "path": "php/Scenarios/CreateDocumentWithOneSignerScenario.php",
    "related_files": [
      "php/index.php",
      "php/Scenarios/Scenario.php",
      "php/resources/sample.pdf"
    ],
    "status": "current",
    "docs_url": "https://docs.lacunasoftware.com/en-us/articles/signer/get-started",
    "demo_url": "https://try.lacunasoftware.com/en/signer/sign-a-document",
    "run": {
      "cwd": "php",
      "command": "composer install && php index.php",
      "url": null
    }
  },
  {
    "id": "create-document-with-attachment-signer",
    "title": "Create a document with an attachment",
    "title_pt": "Criar um documento com um anexo",
    "description": "Uploads the document file and an attachment file, then creates the document with the attachment in `attachments`; `isPrivate` restricts the attachment to the organization's participants (true) or shows it to everyone in the flow (false). Sets `IsPrivate = false`.",
    "product": "signer",
    "area": "documents",
    "language": "dotnet",
    "framework": "console",
    "path": "dotnet/console/Console/Scenarios/CreateDocumentWithAttachmentScenario.cs",
    "related_files": [
      "dotnet/console/Console/Program.cs",
      "dotnet/console/Console/Scenarios/Scenario.cs",
      "dotnet/console/Console/sample.pdf"
    ],
    "status": "current",
    "docs_url": "https://docs.lacunasoftware.com/en-us/articles/signer/integration/documents#the-flow-flowactions",
    "demo_url": null,
    "run": {
      "cwd": "dotnet/console",
      "command": "Open Console.sln in Visual Studio and press F5",
      "url": null
    }
  },
  {
    "id": "create-document-with-attachment-signer",
    "title": "Create a document with an attachment",
    "title_pt": "Criar um documento com um anexo",
    "description": "Uploads the document file and an attachment file, then creates the document with the attachment in `attachments`; `isPrivate` restricts the attachment to the organization's participants (true) or shows it to everyone in the flow (false). Sets `isPrivate` to false.",
    "product": "signer",
    "area": "documents",
    "language": "java",
    "framework": "console",
    "path": "java/console/src/main/java/com/lacunasoftware/signer/sample/scenarios/CreateDocumentWithAttachmentScenario.java",
    "related_files": [
      "java/console/src/main/java/com/lacunasoftware/signer/sample/App.java",
      "java/console/src/main/java/com/lacunasoftware/signer/sample/scenarios/Scenario.java",
      "java/console/src/main/java/com/lacunasoftware/signer/sample/Util.java",
      "java/console/src/main/resources/static/sample.pdf"
    ],
    "status": "current",
    "docs_url": "https://docs.lacunasoftware.com/en-us/articles/signer/integration/documents#the-flow-flowactions",
    "demo_url": null,
    "run": {
      "cwd": "java/console",
      "command": "./gradlew run",
      "url": null
    }
  },
  {
    "id": "create-document-with-attachment-signer",
    "title": "Create a document with an attachment",
    "title_pt": "Criar um documento com um anexo",
    "description": "Uploads the document file and an attachment file, then creates the document with the attachment in `attachments`; `isPrivate` restricts the attachment to the organization's participants (true) or shows it to everyone in the flow (false). Sets `isPrivate: false`.",
    "product": "signer",
    "area": "documents",
    "language": "nodejs",
    "framework": "console",
    "path": "nodejs/scenarios/createDocumentWithAttachmentScenario.ts",
    "related_files": [
      "nodejs/scenarios/scenario.ts",
      "nodejs/samples/sample.pdf"
    ],
    "status": "current",
    "docs_url": "https://docs.lacunasoftware.com/en-us/articles/signer/integration/documents#the-flow-flowactions",
    "demo_url": null,
    "run": {
      "cwd": "nodejs",
      "command": "npm install && npx ts-node scenarios/createDocumentWithAttachmentScenario.ts",
      "url": null
    }
  },
  {
    "id": "create-document-with-attachment-signer",
    "title": "Create a document with an attachment",
    "title_pt": "Criar um documento com um anexo",
    "description": "Uploads the document file and an attachment file, then creates the document with the attachment in `attachments`; `isPrivate` restricts the attachment to the organization's participants (true) or shows it to everyone in the flow (false). Sets `isPrivate` to false.",
    "product": "signer",
    "area": "documents",
    "language": "php",
    "framework": "console",
    "path": "php/Scenarios/CreateDocumentWithAttachmentScenario.php",
    "related_files": [
      "php/index.php",
      "php/Scenarios/Scenario.php",
      "php/resources/sample.pdf"
    ],
    "status": "current",
    "docs_url": "https://docs.lacunasoftware.com/en-us/articles/signer/integration/documents#the-flow-flowactions",
    "demo_url": null,
    "run": {
      "cwd": "php",
      "command": "composer install && php index.php",
      "url": null
    }
  },
  {
    "id": "create-document-with-description-signer",
    "title": "Create a document with a description",
    "title_pt": "Criar um documento com uma descrição",
    "description": "Creates a one-signer document and sets its `description` text.",
    "product": "signer",
    "area": "documents",
    "language": "dotnet",
    "framework": "console",
    "path": "dotnet/console/Console/Scenarios/CreateDocumentWithDescriptionScenario.cs",
    "related_files": [
      "dotnet/console/Console/Program.cs",
      "dotnet/console/Console/Scenarios/Scenario.cs",
      "dotnet/console/Console/sample.pdf"
    ],
    "status": "current",
    "docs_url": "https://docs.lacunasoftware.com/en-us/articles/signer/integration/documents#the-flow-flowactions",
    "demo_url": null,
    "run": {
      "cwd": "dotnet/console",
      "command": "Open Console.sln in Visual Studio and press F5",
      "url": null
    }
  },
  {
    "id": "create-document-with-description-signer",
    "title": "Create a document with a description",
    "title_pt": "Criar um documento com uma descrição",
    "description": "Creates a one-signer document and sets its `description` text.",
    "product": "signer",
    "area": "documents",
    "language": "java",
    "framework": "console",
    "path": "java/console/src/main/java/com/lacunasoftware/signer/sample/scenarios/CreateDocumentWithDescriptionScenario.java",
    "related_files": [